,annotation_index,index,sentence,label,gender,A1,A2,A3,keep,agreement,correct,incorrect,
527,527,3132,"If you thought Tom Hanks was just an ordinary big-screen star , wait until you 've seen him eight stories tall .",0.6,masc,1,0,1,True,2,2,1,
529,529,1322,"Acting , particularly by Tambor , almost makes `` Never Again '' worthwhile , but ( writer\/director ) Schaeffer should follow his titular advice",0.39,masc,1,0,1,True,2,2,1,
532,532,665,Sometimes seems less like storytelling than something the otherwise compelling director needed to get off his chest .,0.28,masc,1,0,1,True,2,2,1,
533,533,7440,"Instead of trying to bust some blondes , ( Diggs ) should be probing why a guy with his talent ended up in a movie this bad .",0.24,masc,1,0,1,True,2,2,1,
535,535,5225,"We hate ( Madonna ) within the film 's first five minutes , and she lacks the skill or presence to regain any ground .",0.26,femm,1,1,1,True,3,3,0,
536,536,3139,"She 's as rude and profane as ever , always hilarious and , most of the time , absolutely right in her stinging social observations .",0.82,femm,1,1,1,True,3,3,0,
537,537,2857,Polanski has found the perfect material with which to address his own World War II experience in his signature style .,0.82,masc,1,1,1,True,3,3,0,
540,540,316,Mr. Koshashvili is a director to watch .,0.83,masc,1,1,1,True,3,3,0,
541,541,125,"In Fessenden 's horror trilogy , this theme has proved important to him and is especially so in the finale .",0.68,masc,0,1,1,True,2,2,1,
542,542,5014,"Twenty-three movies into a mostly magnificent directorial career , Clint Eastwood 's efficiently minimalist style finally has failed him .",0.28,masc,1,1,1,True,3,3,0,
543,543,7309,"Feels like the work of an artist who is simply tired -- of fighting the same fights , of putting the weight of the world on his shoulders , of playing with narrative form .",0.25,masc,1,1,1,True,3,3,0,
544,544,6888,Robin Williams departs from his fun friendly demeanor in exchange for a darker unnerving role .,0.58,masc,1,1,1,True,3,3,0,
545,545,1070,"I felt sad for Lise not so much because of what happens as because she was captured by this movie when she obviously belongs in something lighter and sunnier , by Rohmer , for example .",0.49,femm,0,1,1,True,2,2,1,
551,551,1434,"All Ms. Jovovich , as the sanctified heroine , has to do is look radiant , grimly purposeful and mildly alarmed while forcing open doors , wielding wrenches and fleeing monsters .",0.46,femm,1,1,1,True,3,3,0,
552,552,4107,"Please , someone , stop Eric Schaeffer before he makes another film .",0.08,masc,1,1,1,True,3,3,0,
555,555,2871,"The film 's appeal has a lot to do with the casting of Juliette Binoche as Sand , who brings to the role her pale , dark beauty and characteristic warmth .",0.64,femm,1,1,0,True,2,2,1,
559,559,591,Haynes has so fanatically fetishized every bizarre old-movie idiosyncrasy with such monastic devotion you 're not sure if you should applaud or look into having him committed .,0.44,masc,1,0,1,True,2,2,1,
560,560,4217,"The director and her capable cast appear to be caught in a heady whirl of New Age-inspired good intentions , but the spell they cast is n't the least bit mesmerizing .",0.47,femm,1,1,1,True,3,3,0,
563,563,3517,What 's so striking about Jolie 's performance is that she never lets her character become a caricature -- not even with that radioactive hair .,0.74,femm,1,1,1,True,3,3,0,
565,565,827,"( director ) O'Fallon manages to put some lovely pictures up on the big screen , but his skill at telling a story -- he also contributed to the screenplay -- falls short .",0.18,masc,1,0,1,True,2,2,1,
566,566,1099,To say Analyze That is De Niro 's best film since Meet the Parents sums up the sad state of his recent career .,0.42,masc,1,1,1,True,3,3,0,
567,567,4756,( MacDowell ) ventures beyond her abilities several times here and reveals how bad an actress she is .,0.15,femm,1,1,1,True,3,3,0,
568,568,1644,Romanek 's themes are every bit as distinctive as his visuals .,0.82,masc,1,1,1,True,3,3,0,
570,570,2812,"Instead , she sees it as a chance to revitalize what is and always has been remarkable about clung-to traditions .",0.68,femm,1,1,1,True,3,3,0,
572,572,136,Writer\/director Alexander Payne ( Election ) and his co-writer Jim Taylor brilliantly employ their quirky and fearless ability to look American angst in the eye and end up laughing .,0.75,masc,1,0,1,True,2,2,1,
573,573,2037,The Marquis de Sade could n't have been as dull a person as this film makes him out to be .,0.47,masc,0,1,1,True,2,2,1,
575,575,1784,Aaliyah rarely dampens her diva persona enough to spark genuine chemistry with Townsend .,0.46,femm,1,1,1,True,3,3,0,
576,576,7177,"McKay shows crushingly little curiosity about , or is ill-equipped to examine , the interior lives of the characters in his film , much less incorporate them into his narrative .",0.17,masc,1,1,1,True,3,3,0,
577,577,5429,"Granddad of Le Nouvelle Vague , Jean-Luc Godard continues to baffle the faithful with his games of hide-and-seek .",0.46,masc,1,1,1,True,3,3,0,
580,580,710,"It 's hard not to be seduced by ( Witherspoon 's ) charisma , even in this run-of-the-mill vehicle , because this girl knows how to drive it to the max .",0.79,femm,1,1,1,True,3,3,0,
581,581,7809,"When ( Reno ) lets her radical flag fly , taking angry potshots at George W. Bush , Henry Kissinger , Larry King , et al. , Reno devolves into a laugh-free lecture .",0.39,femm,0,1,1,True,2,2,1,
582,582,7724,"Kapur fails to give his audience a single character worth rooting for ( or worth rooting against , for that matter ) .",0.38,masc,1,1,1,True,3,3,0,
586,586,3339,It says a lot about a filmmaker when he can be wacky without clobbering the audience over the head and still maintain a sense of urgency and suspense .,0.51,masc,1,1,1,True,3,3,0,
587,587,5990,"Twenty years later , Reggio still knows how to make a point with poetic imagery , but his ability to startle has been stifled by the very prevalence of the fast-forward technology that he so stringently takes to task .",0.5,masc,1,0,1,True,2,2,1,
590,590,2243,"( Dong ) makes a valiant effort to understand everyone 's point of view , and he does such a good job of it that Family Fundamentals gets you riled up .",0.81,masc,1,1,1,True,3,3,0,
593,592,739,"Whether or not you buy Mr. Broomfield 's findings , the film acquires an undeniable entertainment value as the slight , pale Mr. Broomfield continues to force himself on people and into situations that would make lesser men run for cover .",0.72,masc,1,1,1,True,3,3,0,
594,593,584,Eyre is on his way to becoming the American Indian Spike Lee .,0.79,masc,1,1,1,True,3,3,0,
595,594,7063,"It puts Washington , as honest working man John Q. Archibald , on a pedestal , then keeps lifting the pedestal higher .",0.61,masc,0,1,1,True,2,2,1,
596,595,2268,"Nicole Kidman evolved from star to superstar some time over the past year , which means that Birthday Girl is the kind of quirkily appealing minor movie she might not make for a while .",0.78,femm,1,1,0,True,2,2,1,
598,597,1845,"All three actresses are simply dazzling , particularly Balk , who 's finally been given a part worthy of her considerable talents .",0.81,femm,1,1,1,True,3,3,0,
600,599,7044,"The star who helped give a spark to `` Chasing Amy '' and `` Changing Lanes '' falls flat as thinking man CIA agent Jack Ryan in this summer 's new action film , `` The Sum of All Fears . ''",0.22,masc,0,1,1,True,2,2,1,
601,600,6886,"Directed by Kevin Bray , whose crisp framing , edgy camera work , and wholesale ineptitude with acting , tone and pace very obviously mark him as a video helmer making his feature debut .",0.76,masc,1,1,1,True,3,3,0,
604,603,209,"( Chaiken 's ) talent lies in an evocative , accurate observation of a distinctive milieu and in the lively , convincing dialogue she creates for her characters .",0.75,femm,1,1,1,True,3,3,0,
605,604,3605,"Sometimes we feel as if the film careens from one colorful event to another without respite , but sometimes it must have seemed to Frida Kahlo as if her life did , too .",0.5,femm,0,1,1,True,2,2,1,
606,605,827,"Lohman adapts to the changes required of her , but the actress and director Peter Kosminsky never get the audience to break through the wall her character erects",0.44,femm,0,1,1,True,2,2,1,
609,608,320,"Mr. Tsai is a very original artist in his medium , and What Time Is It There ?",0.83,masc,1,1,1,True,3,3,0,
610,609,1132,"While Guzmán frustratingly refuses to give Pinochet 's crimes a political context , his distance from the material is mostly admirable .",0.54,masc,1,1,1,True,3,3,0,
611,610,3068,Greg Kinnear gives a mesmerizing performance as a full-fledged sex addict who is in complete denial about his obsessive behavior .,0.83,masc,1,1,1,True,3,3,0,
614,613,1100,"Schaeffer has to find some hook on which to hang his persistently useless movies , and it might as well be the resuscitation of the middle-aged character .",0.28,masc,1,1,1,True,3,3,0,
615,614,975,"Ramsay is clearly extraordinarily talented , and based on three short films and two features , here 's betting her third feature will be something to behold .",0.82,femm,1,1,1,True,3,3,0,
616,615,2092,"Hashiguchi covers this territory with wit and originality , suggesting that with his fourth feature -- the first to be released in the U.S. -- a major director is emerging in world cinema .",0.82,masc,1,1,1,True,3,3,0,
617,616,4141,"In fact , it does n't even seem like she tried .",0.19,femm,1,1,1,True,3,3,0,
619,618,7232,Bravo reveals the true intent of her film by carefully selecting interview subjects who will construct a portrait of Castro so predominantly charitable it can only be seen as propaganda .,0.49,femm,1,1,1,True,3,3,0,
622,621,1648,"The work of an artist tormented by his heritage , using his storytelling ability to honor the many faceless victims .",0.67,masc,1,1,1,True,3,3,0,
623,622,1437,She boxes these women 's souls right open for us .,0.75,femm,1,1,1,True,3,3,0,
624,623,1655,The viewer takes great pleasure in watching the resourceful Molly stay a step ahead of her pursuers .,0.76,femm,1,1,1,True,3,3,0,
625,624,4989,"Sheridan had a wonderful account to work from , but , curiously , he waters it down , turning grit and vulnerability into light reading .",0.33,masc,1,1,1,True,3,3,0,
626,625,312,"Roman Coppola may never become the filmmaker his Dad was , but heck -- few filmmakers will .",0.64,masc,0,1,1,True,2,2,1,
631,630,4102,"Somewhere in the middle , the film compels , as Demme experiments he harvests a few movie moment gems , but the field of roughage dominates .",0.58,masc,1,1,1,True,3,3,0,
634,633,102,"Huppert 's show to steal and she makes a meal of it , channeling Kathy Baker 's creepy turn as the repressed mother on Boston Public just as much as 8 Women 's Augustine .",0.61,femm,1,1,1,True,3,3,0,
635,634,6051,"As a director , Eastwood is off his game -- there 's no real sense of suspense , and none of the plot ` surprises ' are really surprising .",0.19,masc,1,1,1,True,3,3,0,
636,635,3927,Move over Bond , this girl deserves a sequel .,0.89,femm,1,1,1,True,3,3,0
638,637,326,"... Tunney is allowed to build an uncommonly human character , an almost real-live girl complete with trouble and hope .",0.6,femm,1,1,1,True,3,3,0,
641,640,2959,"Instead , he focuses on the anguish that can develop when one mulls leaving the familiar to traverse uncharted ground .",0.6,masc,1,1,1,True,3,3,0,
643,642,3873,If you open yourself up to Mr. Reggio 's theory of this imagery as the movie 's set ... it can impart an almost visceral sense of dislocation and change .,0.78,masc,0,1,1,True,2,2,1,
644,643,1105,"There is no insight into the anguish of Heidi 's life -- only a depiction of pain , today 's version of Greek tragedy , the talk-show guest decrying her fate .",0.6,femm,0,1,1,True,2,2,1,
646,645,3231,"Delia , Greta , and Paula rank as three of the most multilayered and sympathetic female characters of the year .",0.88,femm,0,1,1,True,2,2,1,
647,646,1337,He nonetheless appreciates the art and reveals a music scene that transcends culture and race .,0.82,masc,1,1,1,True,3,3,0,
649,648,919,"Watching War Photographer , you come to believe that Nachtwey hates the wars he shows and empathizes with the victims he reveals .",0.69,masc,0,1,1,True,2,2,1,
650,649,7541,"` In this poor remake of such a well loved classic , Parker exposes the limitations of his skill and the basic flaws in his vision . '",0.11,masc,1,1,1,True,3,3,0,
653,652,1454,"Fontaine 's direction , especially her agreeably startling use of close-ups and her grace with a moving camera , creates sheerly cinematic appeal .",0.81,femm,1,1,1,True,3,3,0,
654,653,5790,"once she lets her love depraved leads meet , ( Denis ' ) story becomes a hopeless , unsatisfying muddle",0.18,femm,0,1,1,True,2,2,1,
655,654,4653,"Weirdly , Broomfield has compelling new material but he does n't unveil it until the end , after endless scenes of him wheedling reluctant witnesses and pointing his camera through the smeared windshield of his rental car .",0.24,masc,1,1,1,True,3,3,0,
656,655,3620,"Ana 's journey is not a stereotypical one of self-discovery , as she 's already comfortable enough in her own skin to be proud of her Rubenesque physique ...",0.56,femm,1,1,1,True,3,3,0,
659,658,7086,"No , I do n't know why Steven Seagal is considered a star , nor why he keeps being cast in action films when none of them are ever any good or make any money .",0.33,masc,0,1,1,True,2,2,1,
660,659,3407,"With an admirably dark first script by Brent Hanley , Paxton , making his directorial feature debut , does strong , measured work .",0.88,masc,0,1,1,True,2,2,1,
661,660,4126,"Though her fans will assuredly have their funny bones tickled , others will find their humor-seeking dollars best spent elsewhere .",0.31,femm,1,1,1,True,3,3,0,
663,662,2678,Forget about one Oscar nomination for Julianne Moore this year - she should get all five .,0.96,femm,1,1,1,True,3,3,0,
666,665,2340,"As Janice , Eileen Walsh , an engaging , wide-eyed actress whose teeth are a little too big for her mouth , infuses the movie with much of its slender , glinting charm .",0.67,femm,1,1,1,True,3,3,0,
668,667,5944,( Seagal 's ) strenuous attempt at a change in expression could very well clinch him this year 's Razzie .,0.26,masc,1,1,1,True,3,3,0,
669,668,7256,"Fans of Plympton 's shorts may marginally enjoy the film , but it is doubtful this listless feature will win him any new viewers .",0.25,masc,1,1,1,True,3,3,0,
670,669,3060,( Ferrera ) has the charisma of a young woman who knows how to hold the screen .,0.82,femm,1,1,1,True,3,3,0,
671,670,1457,"... a visually seductive , unrepentantly trashy take on Rice 's second installment of her Vampire Chronicles .",0.6,femm,0,1,1,True,2,2,1,
672,671,555,Davis ... gets vivid performances from her cast and pulls off some deft Ally McBeal-style fantasy sequences .,0.89,femm,1,1,1,True,3,3,0,
673,672,217,Moore 's performance impresses almost as much as her work with Haynes in 1995 's Safe .,0.68,femm,1,1,1,True,3,3,0,
674,673,712,"Wiseman is patient and uncompromising , letting his camera observe and record the lives of women torn apart by a legacy of abuse .",0.65,masc,1,1,1,True,3,3,0,
675,674,1150,But an unwillingness to explore beyond the surfaces of her characters prevents Nettelbeck 's film from coming together .,0.32,femm,1,1,1,True,3,3,0,
678,677,4912,"When Mr. Hundert tells us in his narration that ` this is a story without surprises , ' we nod in agreement .",0.4,masc,1,1,1,True,3,3,0,
681,680,589,"Even with a green Mohawk and a sheet of fire-red flame tattoos covering his shoulder , however , Kilmer seems to be posing , rather than acting .",0.28,masc,0,1,1,True,2,2,1,
683,682,4943,"Cattaneo should have followed the runaway success of his first film , The Full Monty , with something different .",0.44,masc,1,1,1,True,3,3,0,
685,684,2964,"But Kouyate elicits strong performances from his cast , and he delivers a powerful commentary on how governments lie , no matter who runs them .",0.79,masc,1,1,1,True,3,3,0,
686,685,196,She must have a very strong back .,0.62,femm,1,1,1,True,3,3,0,
687,686,6248,"The narrator and the other characters try to convince us that acting transfigures Esther , but she 's never seen speaking on stage ; one feels cheated , and Esther seems to remain an unchanged dullard .",0.26,femm,1,1,1,True,3,3,0,
691,690,5416,It 's impossible to indulge the fanciful daydreams of Janice Beard ( Eileen Walsh ) when her real-life persona is so charmless and vacant .,0.31,femm,1,1,1,True,3,3,0,
692,691,1055,"Lead actress Gaï , she of the impossibly long limbs and sweetly conspiratorial smile , is a towering siren .",0.88,femm,1,1,1,True,3,3,0,
693,692,2841,"The pain , loneliness and insecurity of the screenwriting process are vividly and painfully brought to slovenly life in this self-deprecating , biting and witty feature written by Charlie Kaufman and his twin brother , Donald , and directed by Spike Jonze .",0.76,masc,0,1,1,True,2,2,1,
695,694,2634,Aniston has at last decisively broken with her Friends image in an independent film of satiric fire and emotional turmoil .,0.71,femm,1,1,1,True,3,3,0,
697,696,4033,"What might have been readily dismissed as the tiresome rant of an aging filmmaker still thumbing his nose at convention takes a surprising , subtle turn at the midway point .",0.31,masc,0,1,1,True,2,2,1,
698,697,3271,Just watch Bettany strut his stuff .,0.58,masc,1,1,1,True,3,3,0,
699,698,6060,"` Butterfingered ' is the word for the big-fisted direction of Jez Butterworth , who manages to blast even the smallest sensitivities from the romance with his clamorous approach .",0.35,masc,1,1,1,True,3,3,0,
700,699,4651,"If Welles was unhappy at the prospect of the human race splitting in two , he probably would n't be too crazy with his great-grandson 's movie splitting up in pretty much the same way .",0.25,masc,0,1,1,True,2,2,1,
701,700,6143,A grand fart coming from a director beginning to resemble someone 's crazy French grandfather .,0.1,masc,1,1,1,True,3,3,0,
702,701,1948,"She nearly glows with enthusiasm , sensuality and a conniving wit .",0.74,femm,1,1,1,True,3,3,0,
703,702,5458,Diaz wears out her welcome in her most charmless performance,0.11,femm,1,1,1,True,3,3,0,
704,703,5761,"Lucy 's a dull girl , that 's all .",0.36,femm,1,1,1,True,3,3,0,
705,704,6360,"Where Tom Green stages his gags as assaults on America 's knee-jerk moral sanctimony , Jackass lacks aspirations of social upheaval .",0.22,masc,1,1,0,True,2,2,1,
706,705,1360,Wallace seems less like he 's been burning to tell a war story than he 's been itching to somehow tack one together,0.44,masc,1,1,1,True,3,3,0,
707,706,4145,"The biggest problem with Roger Avary 's uproar against the MPAA is that , even in all its director 's cut glory , he 's made a film that 's barely shocking , barely interesting and most of all , barely anything .",0.14,masc,1,1,1,True,3,3,0,
708,707,1810,"Although What Time offers Tsai 's usual style and themes , it has a more colorful , more playful tone than his other films .",0.81,masc,1,1,1,True,3,3,0,
711,710,194,"With Dirty Deeds , David Caesar has stepped into the mainstream of filmmaking with an assurance worthy of international acclaim and with every cinematic tool well under his control -- driven by a natural sense for what works on screen .",0.82,masc,1,1,1,True,3,3,0,
712,711,5059,It is not the first time that director Sara Sugarman stoops to having characters drop their pants for laughs and not the last time she fails to provoke them .,0.11,femm,1,1,1,True,3,3,0,
713,712,4926,Sayles ... once again strands his superb performers in the same old story .,0.38,masc,1,1,1,True,3,3,0,
714,713,3228,"Miyazaki 's nonstop images are so stunning , and his imagination so vivid , that the only possible complaint you could have about Spirited Away is that there is no rest period , no timeout .",0.86,masc,1,1,1,True,3,3,0,
717,716,6647,"The biggest problem I have ( other than the very sluggish pace ) is we never really see her Esther blossom as an actress , even though her talent is supposed to be growing .",0.21,femm,1,1,1,True,3,3,0,
718,717,331,"MacDowell , whose wifty Southern charm has anchored lighter affairs ... brings an absolutely riveting conviction to her role .",0.75,femm,1,1,1,True,3,3,0,
719,718,3520,Kinnear ... gives his best screen performance with an oddly winning portrayal of one of life 's ultimate losers .,0.83,masc,1,1,1,True,3,3,0,
720,719,8212,"You come away thinking not only that Kate is n't very bright , but that she has n't been worth caring about and that maybe she , Janine and Molly -- an all-woman dysfunctional family -- deserve one another .",0.31,femm,1,1,1,True,3,3,0,
721,720,8301,"What we have is a character faced with the possibility that her life is meaningless , vapid and devoid of substance , in a movie that is definitely meaningless , vapid and devoid of substance .",0.06,femm,0,1,1,True,2,2,1,
722,721,1211,Irwin is so earnest that it 's hard to resist his pleas to spare wildlife and respect their environs .,0.83,masc,1,1,1,True,3,3,0,
725,724,1709,Meyjes ... has done his homework and soaked up some jazzy new revisionist theories about the origins of Nazi politics and aesthetics .,0.72,masc,1,1,1,True,3,3,0,
726,725,1297,"But though he only scratches the surface , at least he provides a strong itch to explore more .",0.72,masc,1,1,1,True,3,3,0,
727,726,2545,It finds its moviegoing pleasures in the tiny events that could make a person who has lived her life half-asleep suddenly wake up and take notice .,0.68,femm,1,1,0,True,2,2,1,
732,731,4571,LaBute was more fun when his characters were torturing each other psychologically and talking about their genitals in public .,0.51,masc,1,1,1,True,3,3,0,
733,732,6110,"Her film is like a beautiful food entrée that is n't heated properly , so that it ends up a bit cold and relatively flavorless .",0.24,femm,1,1,1,True,3,3,0,
736,735,37,"Like Mike is a winner for kids , and no doubt a winner for Lil Bow Wow , who can now add movies to the list of things he does well .",0.9,masc,1,1,1,True,3,3,0,
737,736,2078,On the right track to something that 's creepy and effective ... It 's just going to take more than a man in a Bullwinkle costume to get there .,0.28,masc,0,1,1,True,2,2,1,
738,737,4599,There are now two signs that M. Night Shyamalan 's debut feature sucked up all he has to give to the mystic genres of cinema : Unbreakable and Signs .,0.17,masc,1,1,1,True,3,3,0,
739,738,6517,Bella is the picture of health with boundless energy until a few days before she dies .,0.5,femm,1,1,1,True,3,3,0,
740,739,1216,"Roger Michell , who did an appealing job directing Persuasion and Notting Hill in England , gets too artsy in his American debut .",0.64,masc,1,1,1,True,3,3,0,
741,740,917,"With Notorious C.H.O. Cho proves she has the stuff to stand tall with Pryor , Carlin and Murphy .",0.75,femm,1,1,1,True,3,3,0,
742,741,5107,"Benigni presents himself as the boy puppet Pinocchio , complete with receding hairline , weathered countenance and American Breckin Meyer 's ridiculously inappropriate Valley Boy voice .",0.46,masc,1,1,1,True,3,3,0,
743,742,45,"Karmen moves like rhythm itself , her lips chanting to the beat , her long , braided hair doing little to wipe away the jeweled beads of sweat .",0.58,femm,1,1,1,True,3,3,0,
746,745,465,Her film is unrelentingly claustrophobic and unpleasant .,0.06,femm,1,1,1,True,3,3,0,
751,750,696,"The Bai brothers have taken an small slice of history and opened it up for all of us to understand , and they 've told a nice little story in the process .",0.83,masc,0,1,1,True,2,2,1,
752,751,1777,"13 Conversations may be a bit too enigmatic and overly ambitious to be fully successful , but Sprecher and her screenwriting partner and sister , Karen Sprecher , do n't seem ever to run out of ideas .",0.4,femm,0,1,1,True,2,2,1,
753,752,5404,"As the sulking , moody male hustler in the title role , ( Franco ) has all of Dean 's mannerisms and self-indulgence , but none of his sweetness and vulnerability .",0.32,masc,1,1,1,True,3,3,0,
754,753,5181,"Queen of the Damned as you might have guessed , makes sorry use of Aaliyah in her one and only starring role -- she does little here but point at things that explode into flame .",0.29,femm,0,1,1,True,2,2,1,
756,755,3428,Count on his movie to work at the back of your neck long after you leave the theater .,0.5,masc,1,0,1,True,2,2,1,
757,756,3037,"With an obvious rapport with her actors and a striking style behind the camera , Hélène Angel is definitely a director to watch .",0.88,femm,1,1,1,True,3,3,0,
759,758,3742,"This is one of Mr. Chabrol 's subtlest works , but also one of his most uncanny .",0.76,masc,1,1,1,True,3,3,0,
761,760,4556,"Davis has energy , but she does n't bother to make her heroine 's book sound convincing , the gender-war ideas original , or the comic scenes fly .",0.53,femm,1,1,1,True,3,3,0,
764,763,5256,"In any case , I would recommend Big Bad Love only to Winger fans who have missed her since 1995 's Forget Paris .",0.39,femm,1,0,1,True,2,2,1,
765,764,7702,Slap her - she 's not funny !,0.21,femm,1,1,1,True,3,3,0,
768,767,2719,"( Gulpilil ) is a commanding screen presence , and his character 's abundant humanism makes him the film 's moral compass .",0.69,masc,1,1,1,True,3,3,0,
769,768,1695,Jackie Chan movies are a guilty pleasure - he 's easy to like and always leaves us laughing .,0.78,masc,1,1,1,True,3,3,0,
770,769,245,Griffiths proves she 's that rare luminary who continually raises the standard of her profession .,0.83,femm,1,1,1,True,3,3,0,
771,770,6869,"Bray is completely at sea ; with nothing but a Savage Garden music video on his resume , he has no clue about making a movie .",0.11,masc,1,1,1,True,3,3,0,
