,annotation_index,index,sentence,label,gender,A1,A2,A3,keep,agreement,correct,incorrect,
772,771,1797,"As commander-in-chief of this film , Bigelow demonstrates a breadth of vision and an attention to detail that propels her into the upper echelons of the directing world .",0.85,femm,1,1,1,True,3,3,0,
773,772,995,"A lot of the credit for the film 's winning tone must go to Grant , who has n't lost a bit of the dry humor that first made audiences on both sides of the Atlantic love him .",0.67,masc,1,1,1,True,3,3,0,
774,773,392,"With each of her three protagonists , Miller eloquently captures the moment when a woman 's life , out of a deep-seated , emotional need , is about to turn onto a different path .",0.83,femm,1,1,1,True,3,3,0,
775,774,5568,He has a great cast and a great idea .,0.89,masc,1,1,1,True,3,3,0,
776,775,578,"It 's the perfect star vehicle for Grant , allowing him to finally move away from his usual bumbling , tongue-tied screen persona .",0.67,masc,0,1,1,True,2,2,1,
778,777,4843,Kapur 's contradictory feelings about his material result in a movie that works against itself .,0.32,masc,1,1,1,True,3,3,0,
779,778,2530,Mike Leigh populates his movie with a wonderful ensemble cast of characters that bring the routine day to day struggles of the working class to life,0.86,masc,1,1,1,True,3,3,0,
781,780,2261,"If Reno is to the left of liberal on the political spectrum , her tough , funny , rather chaotic show is n't subversive so much as it is nit-picky about the hypocrisies of our time .",0.54,femm,1,1,1,True,3,3,0,
782,781,964,"Green might want to hang onto that ski mask , as robbery may be the only way to pay for his next project .",0.18,masc,1,1,1,True,3,3,0,
783,782,1234,"She 's all-powerful , a voice for a pop-cyber culture that feeds on her Bjorkness .",0.75,femm,1,1,1,True,3,3,0,
785,784,1243,"Birot is a competent enough filmmaker , but her story has nothing fresh or very exciting about it .",0.25,femm,1,1,1,True,3,3,0,
786,785,549,"The script kicks in , and Mr. Hartley 's distended pace and foot-dragging rhythms follow .",0.39,masc,1,1,1,True,3,3,0,
787,786,1983,"All leather pants & augmented boobs , Hawn is hilarious as she tries to resuscitate the fun-loving libertine lost somewhere inside the conservative , handbag-clutching Sarandon .",0.64,femm,1,1,1,True,3,3,0,
